{
  "schema_version": 1,
  "result_root": "../results",
  "suites": [
    "../suites/scope-withdrawal.json"
  ],
  "providers": {
    "vera-llama-cpp": {
      "type": "llama_cpp",
      "base_url": "http://127.0.0.1:18081/v1",
      "server_path": "C:\\MineTrackerAI\\llama.cpp\\llama-server.exe",
      "model_path": "C:\\MineTrackerAI\\models\\qwen2.5-3b-instruct-q4_k_m.gguf",
      "model_sha256": "626b4a6678b86442240e33df819e00132d3ba7dddfe1cdc4fbb18e0a9615c62d",
      "alias": "vera-qwen25-3b-instruct-q4km",
      "ctx_size": 4096,
      "startup_timeout_seconds": 180
    },
    "ollama-local": {
      "type": "ollama",
      "base_url": "http://localhost:11434",
      "keep_alive": "5m"
    }
  },
  "models": [
    {
      "id": "vera-qwen25-3b-instruct-q4km",
      "provider": "vera-llama-cpp",
      "name": "vera-qwen25-3b-instruct-q4km",
      "options": {
        "temperature": 0,
        "seed": 42,
        "max_tokens": 2048
      }
    },
    {
      "id": "qwen25-coder-7b-native-json",
      "provider": "ollama-local",
      "name": "qwen2.5-coder:7b",
      "options": {
        "temperature": 0,
        "seed": 42,
        "num_ctx": 4096,
        "num_predict": 2048,
        "format": "json"
      }
    },
    {
      "id": "deepseek-coder-67b-native-json",
      "provider": "ollama-local",
      "name": "deepseek-coder:6.7b-instruct",
      "options": {
        "temperature": 0,
        "seed": 42,
        "num_ctx": 4096,
        "num_predict": 2048,
        "format": "json"
      }
    },
    {
      "id": "qwen25-coder-14b-native-json",
      "provider": "ollama-local",
      "name": "qwen2.5-coder:14b",
      "options": {
        "temperature": 0,
        "seed": 42,
        "num_ctx": 4096,
        "num_predict": 2048,
        "format": "json"
      }
    },
    {
      "id": "phi4-14b-native-json",
      "provider": "ollama-local",
      "name": "phi4:14b",
      "options": {
        "temperature": 0,
        "seed": 42,
        "num_ctx": 4096,
        "num_predict": 2048,
        "format": "json"
      }
    }
  ],
  "run": {
    "timeout_seconds": 1800,
    "retries": 1,
    "retry_delay_seconds": 5,
    "unload_after_model": true
  },
  "evaluation": {
    "enabled": true
  }
}
