{
  "schema_version": 1,
  "result_root": "../results",
  "suites": [
    "../suites/sample.json",
    "../suites/sample.md"
  ],
  "providers": {
    "ollama-local": {
      "type": "ollama",
      "base_url": "http://localhost:11434",
      "keep_alive": "5m"
    }
  },
  "models": [
    {
      "id": "qwen25-coder-7b",
      "provider": "ollama-local",
      "name": "qwen2.5-coder:7b",
      "options": {
        "temperature": 0,
        "seed": 42,
        "num_ctx": 4096,
        "num_predict": 1024
      }
    },
    {
      "id": "deepseek-coder-67b",
      "provider": "ollama-local",
      "name": "deepseek-coder:6.7b-instruct",
      "options": {
        "temperature": 0,
        "seed": 42,
        "num_ctx": 4096,
        "num_predict": 1024
      }
    },
    {
      "id": "starcoder2-7b",
      "provider": "ollama-local",
      "name": "starcoder2:7b",
      "options": {
        "temperature": 0,
        "seed": 42,
        "num_ctx": 4096,
        "num_predict": 1024
      }
    }
  ],
  "run": {
    "timeout_seconds": 900,
    "retries": 1,
    "retry_delay_seconds": 5,
    "unload_after_model": true
  }
}

