{
  "schema_version": 1,
  "result_root": "../results",
  "suites": [
    "../suites/planning-round-2.json"
  ],
  "providers": {
    "ollama-local": {
      "type": "ollama",
      "base_url": "http://localhost:11434",
      "keep_alive": "5m"
    }
  },
  "models": [
    {
      "id": "qwen25-coder-14b-native-json",
      "provider": "ollama-local",
      "name": "qwen2.5-coder:14b",
      "options": {
        "temperature": 0,
        "seed": 42,
        "num_ctx": 4096,
        "num_predict": 2048,
        "format": "json"
      }
    }
  ],
  "run": {
    "timeout_seconds": 1800,
    "retries": 1,
    "retry_delay_seconds": 5,
    "unload_after_model": true
  },
  "evaluation": {
    "enabled": true
  }
}
